corpus_id;document_id;sentence_id;content;document_uri;corpus_uri
MusicBO;105;4063;alla morte del Martini ( 1784 ) la Religione lo chiamò con nomina formale a succedergli come maestro della cappella di San Francesco , ufficio ch' egli occupava già da molti anni .;;https://doi.org/10.5281/zenodo.6672165
MusicBO;105;6543;"A questo male si aggiunse una fistola che fu operata dal dottor Nélaton ;";;https://doi.org/10.5281/zenodo.6672165
MusicBO;105;2045;"Questo brioso compositore aveva conservato fino agli ultimi suoi giorni tutta la ricchezza dell' immaginazione ;";;https://doi.org/10.5281/zenodo.6672165
MusicBO;105;3317;Progettò allora di passare in Francia , ove la sua musica 296 Luigi Boccherini godeva la simpatia di tutti gli amatori di gusto , ma gli mancavano i mezzi per intraprendere così lungo viaggio .;;https://doi.org/10.5281/zenodo.6672165
MusicBO;105;1868;È nota l' origine della famosa Soraza del diavolo di Tartini .;;https://doi.org/10.5281/zenodo.6672165
MusicBO;105;586;"Nel 1625 il Barberini andò in Francia col titolo di legato , e il Doni ve lo accompagnava , lieto di poter rivedere gli amici ;";;https://doi.org/10.5281/zenodo.6672165
MusicBO;105;1280;"Verso la fine dello stesso anno ( 1718 ) Lotti ritornò a Venezia , e d’ allora non si occupò più di musica drammatica , ma scrisse solamente per la chiesa . ;";;https://doi.org/10.5281/zenodo.6672165
MusicBO;105;1731;Teti Giuseppe 1artini dì Te grande successore di Corelli , Giuseppe Tartini , { IN compositore e teorico celeberrimo , sortì i natali in $ i Pirano d’ Istria il 12 aprile 1692 .;;https://doi.org/10.5281/zenodo.6672165
MusicBO;105;6687;"La dal lerina raggtratrice , opera buffa , Firenze , teatro della Pergola , primavera 1814 ;";;https://doi.org/10.5281/zenodo.6672165
MusicBO;14;101;"il 12 novembre 1882 diretto da Luigi Mancinelli ( 12 rappresentazioni ) , con Ottavio Nouvelli nella parte del protagonista , Nadina Bulicioff ( Elsa ) e Angelo Tamburlini ( Enrico ) ;";http://www.luigiverdi.it/wagner_e_wagnerismo.htm;https://doi.org/10.5281/zenodo.6672165
MusicBO;105;2465;Rimasto vacante il posto di 72720 m2aestrino , fu aperto un concorso fra gli scolari del Conservatorio , e si diede loro per tema una Fuga ad otto parti reali .;;https://doi.org/10.5281/zenodo.6672165
MusicBO;16;1147;Et prò eo francisco de Sancto losep .;https://books.google.it/books?id=y0VDAAAAYAAJ&printsec=frontcover&hl=it&source=gbs_ge_summary_r&cad=0#v=onepage&q&f=false;https://doi.org/10.5281/zenodo.6672165
MusicBO;105;3054;Il Sacchini allora prese dimora per sette anni in Roma facendo di tratto in tratto brevi escursioni a Firenze , a Napoli e ad altre città per mettervi in scena opere serie e buffe .;;https://doi.org/10.5281/zenodo.6672165
MusicBO;105;4479;Ma il pubblico non era ancora abbastanza intelligente , nè abbastanza finemente educato per apprezzare al loro giusto valore le bellezze di stile e d’ esecuzione che gli erano offerte dall' artista italiano .;;https://doi.org/10.5281/zenodo.6672165
MusicBO;105;925;i suoi studî musicali non furono intrapresi in verun Conservatorio napoletano , ma è da notare che l' educazione sua non dovette essere comune o superficiale trovandolo gran musico ( compositore e probabilmente cantante e suonatore di più stromenti ) , poeta latino , e , a quanto pare , italiano ancora .;;https://doi.org/10.5281/zenodo.6672165
MusicBO;105;116;"Si riconobbe ben presto la necessità d’ una sillaba corrispondente a 2 , e si usò il 27 , Ci , Di , Nî , Za ;";;https://doi.org/10.5281/zenodo.6672165
MusicBO;105;768;"Quinault presentava al re il piano di diversi libretti ;";;https://doi.org/10.5281/zenodo.6672165
MusicBO;105;2447;Poco dopo passò direttore della cappella ducale in Assia - Cassel con mille scudi d’ Allemagna di stipendio , e vi rimase fino al 1780 , epoca nella quale chiese la pensione .;;https://doi.org/10.5281/zenodo.6672165
MusicBO;105;3719;L' imperatore nel congedarlo gli fece il presente d’ una tabacchiera col suo ritratto contornato di brillanti e d' una collana di pietre preziose per la moglie .;;https://doi.org/10.5281/zenodo.6672165
MusicBO;105;5369;Spontini , Weber , Meyerbeer , ont un ensemble de doctrines qui ressort de leurs ceuvres mémes .;;https://doi.org/10.5281/zenodo.6672165
MusicBO;105;3171;fra queste la principale si fu che l’ opera di Anfossi comparve sulla scena in un' epoca in cui un partito avverso a Piccinni cercava un rivale da opporgli .;;https://doi.org/10.5281/zenodo.6672165
MusicBO;112;427;perciò il fettimo mefe viene detto di ftrepito , e di trombe , alludendo ai canti di grazie per i frutti della terra loro .;https://www.google.it/books/edition/Memorie_storiche_del_p_m_Giambattista_Ma/oayWg6-HWEIC?hl=it&gbpv=0;https://doi.org/10.5281/zenodo.6672165
MusicBO;105;6112;"La Violette ou Gérard de Nevers ( in SASA con Leborne ) , eseguita il 7 ottobre 1828 , fu trovata inferiore alla fama che l’ autore s' era acquistata col Masazie / lo ;";;https://doi.org/10.5281/zenodo.6672165
MusicBO;105;6155;Forti dolori reumatici , frutto delle sue campagne , precedettero una paralisi che l’ obbligò a rimanersene continuamente in stanza .;;https://doi.org/10.5281/zenodo.6672165
MusicBO;105;2953;Ogni suonatore soffiava la sua nota ogni qualvolta essa si presentava nel pezzo , e si dice che qualche orchestra abilissima arrivasse ad eseguire così senza esitazione Fughe , Sinfonie e Concerti con rapide volate ed anche con trilli !;;https://doi.org/10.5281/zenodo.6672165
MusicBO;105;3511;Un Aegzuzemn a quattro voci , trovato fra le sue att Giovanni Paisiello 219 carte , fu eseguito alle solenni esequie celebrate in suo onore .;;https://doi.org/10.5281/zenodo.6672165
MusicBO;105;5638;L' artista , emancipato dal giogo paterno , camminava a passi da gigante sulla via della celebrità e della gloria , ma la saviezza dei propositi non era in lui così precoce come il genio .;;https://doi.org/10.5281/zenodo.6672165
MusicBO;105;1055;"Corelli rifiutò diverse volte le sue offerte , sia perchè temeva la gelosia dei violinisti di quel paese , sia perchè amava la sua tranquillità di Roma ;";;https://doi.org/10.5281/zenodo.6672165
MusicBO;105;5201;forse egli non seppe godere con parsimonia dei vantaggi d' una robusta costituzione .;;https://doi.org/10.5281/zenodo.6672165
MusicBO;105;5088;"Semplicità ed astuzia , Napoli , teatro Nuovo , 1810 ; Raou/ de Crequi , opera se -_ miseria in .";;https://doi.org/10.5281/zenodo.6672165
MusicBO;105;2353;I suoi genitori Francesco Antonio , ricco negoziante , e Margherita Cristiano lo vollero educare alle lettere ed alle arti belle per nobilitarne la condizione .;;https://doi.org/10.5281/zenodo.6672165
MusicBO;105;4972;"C % i dura vince , opera buffa , Roma , teatro Valle , carnevale 1803 ;";;https://doi.org/10.5281/zenodo.6672165
MusicBO;105;6095;Da Roma il Carafa passò a Vienna , ove lo si aveva invitato a comporre pel teatro Italiano di corte :;;https://doi.org/10.5281/zenodo.6672165
MusicBO;105;5014;Urania , cantata , Trieste , teatro Grande , 1829 .;;https://doi.org/10.5281/zenodo.6672165
MusicBO;105;3711;Tante eccellenti produzioni portarono così alta la fama di Cimarosa che , dopo il ritorno di Paisiello da Pietroburgo , ei fu chiamato da Caterina II ad occupare il posto lasciato libero dal suo rivale .;;https://doi.org/10.5281/zenodo.6672165
MusicBO;16;218;Il marchese Campori sopra ricordato nella Notizia dei Miniatori dei Principi Estensi ( i ) , ci dice eh ' era figlio di Giorgio d' Alemagna e di Prisciana o Parisina ( 2 ) , ed ebbe a fratelli Nicolò Maria , Sigismondo e Paola .;https://books.google.it/books?id=y0VDAAAAYAAJ&printsec=frontcover&hl=it&source=gbs_ge_summary_r&cad=0#v=onepage&q&f=false;https://doi.org/10.5281/zenodo.6672165
MusicBO;105;707;Ebbe educazione musicale in Bergamo , e vi divenne organista della chiesa di Santa Maria Maggiore .;;https://doi.org/10.5281/zenodo.6672165
MusicBO;105;1949;Za vecchia trammera , Napoli , teatro Nuovo , 1732 ( musica di Ant.;;https://doi.org/10.5281/zenodo.6672165
MusicBO;105;5464;la prima riuscì felicemente , ma l’ altra ebbe esito mediocre .;;https://doi.org/10.5281/zenodo.6672165
MusicBO;105;7314;Al suo arrivo a Parigi ( 1834 ) venne festeggiato da tutti gli artisti , e specialmente dal vecchio Cherubini e da Gioachino Rossini , col quale si legò d’ un’ intima amicizia .;;https://doi.org/10.5281/zenodo.6672165
MusicBO;105;1229;Lo troviamo a Napoli nel 1725 , e si sa che godè poi un gran favore alla corte di Madrid , ove si recava nel 1729 per dare lezioni di clavicembalo alla principessa delle Asturie .;;https://doi.org/10.5281/zenodo.6672165
MusicBO;105;2149;Il P. Martini , partigiano della scuola romana ed ammiratore de maestri ch’ essa aveva prodotto , intese a propagare le dottrine che avevano portato la musica sacra a tanta altezza ispirando ai suoi allievi tutta la purezza di stile , ed il modo elegante di far cantare le parti dei compositori romani .;;https://doi.org/10.5281/zenodo.6672165
MusicBO;112;891;Nelle ftatue greche il rifo di Bacco fi diltingue apertamente dal rifo di Venere , come il rifo di un villano , che digrigna i denti , è notabilmente diverfo da quello del cirtadino ( 4 ) .;https://www.google.it/books/edition/Memorie_storiche_del_p_m_Giambattista_Ma/oayWg6-HWEIC?hl=it&gbpv=0;https://doi.org/10.5281/zenodo.6672165
MusicBO;105;5567;Per qualche anno si occupò esclusivamente di musica sacra , ma nel 1827 riprese la carriera teatrale facendo rappresentare ( tI marzo ) alla Pergola di Firenze Jefte , oratorio drammatico , che se in sulle prime non' ebbe fortuna , fu degnamente apprezzato in seguito .;;https://doi.org/10.5281/zenodo.6672165
MusicBO;105;4967;In questo il chiaro autore , già noto per le sue diligenti ricerche sulla storia della mus'ca drammatica sotto ì nomi di L. Lianovosani e Livio Niso Galvani , cita come data della m rte del maestro il 12 dicembre 1837 .;;https://doi.org/10.5281/zenodo.6672165
MusicBO;105;2112;"L' applicazione di dodici anni sotto un tale maestro pose in grado il Cafaro di ritornare presso il suo ospite fornito di profonde cognizioni musicali ;";;https://doi.org/10.5281/zenodo.6672165
MusicBO;105;1546;Serenata da cantarsi alla corte di Vienna il primo d’ ottobre 1725 .;;https://doi.org/10.5281/zenodo.6672165
MusicBO;112;1277;nacque la mufica moderna dal canto fermo .;https://www.google.it/books/edition/Memorie_storiche_del_p_m_Giambattista_Ma/oayWg6-HWEIC?hl=it&gbpv=0;https://doi.org/10.5281/zenodo.6672165
MusicBO;105;1965;"Alidoro , Napoli , teatro dei Fiorentini , 1740 ;";;https://doi.org/10.5281/zenodo.6672165
MusicBO;105;267;Arteaga , Ze rivoluzioni del teatro musicale italiano .;;https://doi.org/10.5281/zenodo.6672165
MusicBO;16;75;1 ^ ] questi il primo scrittore , che incontrasi ricordato nel Giornale XllI , pag. i i , il quale scrisse lettere rosse nel libro delle lamentazioni di Geremia .;https://books.google.it/books?id=y0VDAAAAYAAJ&printsec=frontcover&hl=it&source=gbs_ge_summary_r&cad=0#v=onepage&q&f=false;https://doi.org/10.5281/zenodo.6672165
MusicBO;105;6816;Ammesso nel Collegio della Pietà dei Turchini ( 1808 ) quando contava il tredicesimo anno di età , Mercadante , dopo essersi istruito negli elementi musicali e nel solfeggio , si dedicò allo studio di violino , ed in breve tempo divenne solista e concertatore d' orchestra , ufficio che veniva assegnato al primo maestrino per la parte istromentale .;;https://doi.org/10.5281/zenodo.6672165
MusicBO;105;1244;lui stesso si disse veneziano nel libretto del dramma pastorale 77757 di cui pose in musica il primo atto , e nel titolo del suo libro di Madrigali , e Caffi , nella Sforza della musica sacra nella già cappella ducale di San Marco in Venezia , ta osservare che un fratello del Lotti ottenne in Venezia un impiego che non si potea dare che ad un veneziano .;;https://doi.org/10.5281/zenodo.6672165
MusicBO;105;3267;Tale ingiustizia fu riparata da Don Luigi , fratello di Carlo III , che gli diede il titolo di Virtuoso e compositore al servizio di S. A. R. Don Luigi Infante di Spagna , e Boccherini gli mostrò la sua gratitudine dedicandogli nel medesimo anno ( 17609 ) sei Quartetti per istromenti ad arco ( op.;;https://doi.org/10.5281/zenodo.6672165
MusicBO;105;3649;"I Pitagorici , opera seria , Napoli , teatro San Carlo , 19 marzo 1808 ;";;https://doi.org/10.5281/zenodo.6672165
MusicBO;105;4627;Collaborò dapprima con altri musicisti all’ opera Demetrio , poi scrisse pel teatro di Sua Maestà La finta principessa , opera buffa che ottenne molta voga .;;https://doi.org/10.5281/zenodo.6672165
MusicBO;105;6957;A diciotto anni passò a Bologna , ove si diede per tre anni a studî severi sotto la direzione del Pilotti dapprima , e poi del Padre Mattei , al quale il Mayr lo aveva caldamente raccomandato .;;https://doi.org/10.5281/zenodo.6672165
MusicBO;105;1646;Ripete che i più grandi compositori l' hanno sempre riguardato come modello dell’ arte del piacere melodico , e conchiude che Porpora fu grande pel suo merito e molto più grande dee riputarsi per aver diffuso il buon gusto della scuola armonica ( !;;https://doi.org/10.5281/zenodo.6672165
MusicBO;105;3826;"Domenico Cimarosa 237 sposi per accidente , opera semiseria in 3 atti , Napoli , teatro dei Fiorentini , 1780 ; // falegname , opera semiseria in 3 atti , Napoli , teatro dei Fiorentini , 1750 ( riprodotta in 2 atti al teatro San Carlino nel 1791 , ed ai Fiorentini nel 1803 ) ;";;https://doi.org/10.5281/zenodo.6672165
MusicBO;105;7238;Ancona , Morelli , 1882 ) scrisse la storia aneddotica di questo spartito valendosi di documenti autentici quali l Episto /ario Belliniano raccolto dal Florimo , e la Biografia di Felice Romani che la vedova del poeta va mettendo assieme .;;https://doi.org/10.5281/zenodo.6672165
MusicBO;105;1683;"; Angelica e Medoro , azione teatrale del Metastasio , +.";;https://doi.org/10.5281/zenodo.6672165
MusicBO;105;1066;« Ricominciamo , » e Corelli conservò ancora il tono maggiore fino a che fu avvisato dello sbaglio dallo stesso Scar62 Arcangelo Corelli latti .;;https://doi.org/10.5281/zenodo.6672165
MusicBO;105;5556;Alla Scala ebbero brillante successo le sue opere buffe C % z zon risica non rosica ( 18 maggio 1811 ) , e La vedova delirante ( 30 marzo 1812 ) .;;https://doi.org/10.5281/zenodo.6672165
MusicBO;105;3246;Consiglio di Lucca domandando l’ impiego di primo violoncellista alla cappella della Serenissima Repubblica , e l’ ottenne solo nel 1764 , ma lo stipendio ne era tanto meschino , ch’ ei si trovò costretto a cercare altri mezzi per campare la vita .;;https://doi.org/10.5281/zenodo.6672165
MusicBO;16;353;Pasqualino di Battista dai libri ( 22 aprile 1480 ) .;https://books.google.it/books?id=y0VDAAAAYAAJ&printsec=frontcover&hl=it&source=gbs_ge_summary_r&cad=0#v=onepage&q&f=false;https://doi.org/10.5281/zenodo.6672165
MusicBO;14;119;la nuova moda del verismo musicale aveva concentrato l’ attenzione del pubblico sulle nuove opere dei giovani autori emergenti ( Puccini , Mascagni , Giordano ) .;http://www.luigiverdi.it/wagner_e_wagnerismo.htm;https://doi.org/10.5281/zenodo.6672165
MusicBO;105;6243;Col loro mezzo ottenne una scrittura come compositore per il .teatro San Moisè di Venezia , e quivi nell' autunno del 1810 fece rappresentare la farsa La cambiale di matrimonio .;;https://doi.org/10.5281/zenodo.6672165
MusicBO;105;911;Altre composizioni del musicista sono sparse nella Biblioteca del Conservatorio di Napoli ( Raccolta di cantate ) , nella Biblioteca imperiale di Parigi ( Due duetti per soprano e basso ) , in quella del Conservatorio di Parigi , nel Museo britannico di Londra e nella Biblioteca d’ Oxford .;;https://doi.org/10.5281/zenodo.6672165
MusicBO;105;3404;Verso il 1772 egli sposò Cecilia Pollini , donna amorosissima che gli rese felice la vita .;;https://doi.org/10.5281/zenodo.6672165
MusicBO;16;721;Con questa carta termina la parte originale di questo Codice , le cui ultime cinque carte , che contenevano la Messa In Conimemorat .;https://books.google.it/books?id=y0VDAAAAYAAJ&printsec=frontcover&hl=it&source=gbs_ge_summary_r&cad=0#v=onepage&q&f=false;https://doi.org/10.5281/zenodo.6672165
MusicBO;16;800;Laetabitur iiistiis in Domino in eodem Comm.;https://books.google.it/books?id=y0VDAAAAYAAJ&printsec=frontcover&hl=it&source=gbs_ge_summary_r&cad=0#v=onepage&q&f=false;https://doi.org/10.5281/zenodo.6672165
MusicBO;105;952;"Due soprani , contralto , baritono , basso e coro a quattro voci ;";;https://doi.org/10.5281/zenodo.6672165
MusicBO;105;1149;il cardinale Ottoboni , che gli aveva dato il titolo di direttore della sua musica , gli ottenne dal papa la decorazione dello Sperone d’ oro .;;https://doi.org/10.5281/zenodo.6672165
MusicBO;105;589;Nelle sue ricerche sugli strumenti degli antichi , il Doni si era occupato in ispecialità della lira , e credè di averne trovato la forma e le proporzioni .;;https://doi.org/10.5281/zenodo.6672165
MusicBO;105;6773;"Cazzata per l' onomastico di Don Pedro imperatore del Brasile , Rio Janeiro ;";;https://doi.org/10.5281/zenodo.6672165
MusicBO;105;2064;"Orozze re de Sciti , Venezia , teatro San Giovanni Grisostomo , 1740 ;";;https://doi.org/10.5281/zenodo.6672165
MusicBO;105;2730;Il nome di Piccinni divenne allora famoso in Italia .;;https://doi.org/10.5281/zenodo.6672165
MusicBO;105;2278;tei n nnt cn Giovanni Battista Pergolesi 135 Guglielmo di Aquitania , sulle parole di Ignazio Mancini , composizione che venne eseguita nel chiostro di S. Agnello Maggiore in Napoli .;;https://doi.org/10.5281/zenodo.6672165
MusicBO;105;260;Il Meyer e qualche altro autore dicono che lo Zarlino scrisse pel teatro l’ Or /eo , una di quelle composizioni musicali allora in voga ( 2 ) e che si ‘ possono considerare come i primi abbozzi del melodramma che si sviluppò completamente dopo qualche anno .;;https://doi.org/10.5281/zenodo.6672165
MusicBO;105;3455;"Due anni dopo scoppiò a Napoli la rivoluzione e la corte si ritirò a Palermo ;";;https://doi.org/10.5281/zenodo.6672165
MusicBO;105;1222;Questo compositore è il primo che scosse il giogo di precetti stabiliti da una vecchia pratica , .;;https://doi.org/10.5281/zenodo.6672165
MusicBO;105;2636;la fede di nascita però riportata dalla Gazzetta Musicale di Niulano , N. 50 , anno 1879 , toglie ogni dubbio :;;https://doi.org/10.5281/zenodo.6672165
MusicBO;105;2502;Molto amante del bel sesso , sprecò la maggior parte della sua fortuna mantenendo relazioni poco convenienti .;;https://doi.org/10.5281/zenodo.6672165
MusicBO;14;59;Riccardo Wagner fu molto toccato per l’ onore conferitogli dalla città di Bologna , e rispose il 3 ottobre 1872 con una lettera molto conosciuta , tradotta in italiano su tutti i giornali bolognesi e poi citata su innumerevoli pubblicazioni successive , dove scrisse fra l’ altro :;http://www.luigiverdi.it/wagner_e_wagnerismo.htm;https://doi.org/10.5281/zenodo.6672165
MusicBO;105;6620;Rossini in seguito ha rifatto i pezzi di cui non era autore , e la partizione data alle stampe non porta traccia di questa collaborazione di circostanza .;;https://doi.org/10.5281/zenodo.6672165
MusicBO;105;5330;assurda calunnia alla quale ei rispose gloriosamente con il Ferzando Cortez , rappresentato all’ Opéra il Ù ) 28 novembre del 1809 .;;https://doi.org/10.5281/zenodo.6672165
MusicBO;105;5012;"La donna di Bessarabia , dramma , Venezia , teatro San Moisè , carnevale 1817 ; £ gerza , cantata con cori e danze , eseguita ai 12 febbraio 1826 , natalizio di Francesco I , nel teatro Grande di Trieste ;";;https://doi.org/10.5281/zenodo.6672165
MusicBO;105;6794;"Rossini e la patria , cantata , Pesaro , 22 agosto 1864 ;";;https://doi.org/10.5281/zenodo.6672165
MusicBO;105;5723;Nicolò Paganini 361 Verso il maggio di quell’ anno Paganini passò a Londra , ove lo aspettava egualmente la curiosità , ma non quell’ interesse artistico ed intelligente che lo aveva accolto nella capitale della Francia .;;https://doi.org/10.5281/zenodo.6672165
MusicBO;105;5519;"Cantata per festeggiare le nozze del duca di Savoja con l’ arciduchessa d' Austria Maria Adelaide ; Zusitant , cantata a grande orchestra con varie bande militari , per l’ arrivo dal Brasile in Lisbona del re ;";;https://doi.org/10.5281/zenodo.6672165
MusicBO;105;4262;La musica dello Zingarelli piacque assai , e diede a vedere come nel vecchio maestro non fossero ancora esauriti la fervida fantasia e l’ estro dei modi teatrali .;;https://doi.org/10.5281/zenodo.6672165
MusicBO;105;6801;Saverio Mercadante nacque in Altamura il 17 settembre 1795 ( I ) da Giuseppe Mercadante e da una domestica a nome Rosa Bia , La madre amava Gil Sfancnlio Neamani padre , come frutto di segreti amori , non voleva riconoscerlo e legittimarlo .;;https://doi.org/10.5281/zenodo.6672165
MusicBO;112;1808;Ho fatto ricerche in Venezia ‘ , ove abita ‘ no molti Greci Religiofi , e quì in Bologna ab » biamo qualche Greco , che viene a ftudiare medicina , ma non mi è flato pofiibile ritrovar alcuno che mi abbia faputo indicare il fignificato di tali caratteri ..;https://www.google.it/books/edition/Memorie_storiche_del_p_m_Giambattista_Ma/oayWg6-HWEIC?hl=it&gbpv=0;https://doi.org/10.5281/zenodo.6672165
MusicBO;105;490;Questo principe avea fatto di Ferrara Fa Claudio Monteverde ebbe massima importanza per il progresso dell’ arte musicale l’ accademia di eruditi gentiluomini toscani che radunavansi in casa di Giovanni Bardi conte del Vernio in Firenze .;;https://doi.org/10.5281/zenodo.6672165
MusicBO;14;159;[ 7 ] Claudio Santini - Lamberto Trezzini , La questione wagneriana , in Due secoli di vita musicale .;http://www.luigiverdi.it/wagner_e_wagnerismo.htm;https://doi.org/10.5281/zenodo.6672165
MusicBO;105;3068;Nella capitale delI Inghilterra fece dapprima rappresentare alcune delle opere scritte in Italia , ritoccandole in parte ( Z / gran Cid e Lucio Vero ) , e compose in appresso pel teatro del Re :;;https://doi.org/10.5281/zenodo.6672165
MusicBO;112;6;Commenti , note e altre annotazioni a margine presenti nel volume originale compariranno in questo file , come testimonianza del lungo viaggio percorso dal libro , dall’ editore originale alla biblioteca , per giungere fino a te .;https://www.google.it/books/edition/Memorie_storiche_del_p_m_Giambattista_Ma/oayWg6-HWEIC?hl=it&gbpv=0;https://doi.org/10.5281/zenodo.6672165
MusicBO;105;4140;ella gli diede lettere di raccomandazione per alcune dame dell’ alta società di Milano , ove lo Zingarelli aveva deciso di recarsi .;;https://doi.org/10.5281/zenodo.6672165
MusicBO;14;18;Si aggiunga il fatto che la celebre cantante Teresa Stolz , convivente fino allora di Angelo Mariani , si separò da lui , forse sotto l’ influenza del Verdi .;http://www.luigiverdi.it/wagner_e_wagnerismo.htm;https://doi.org/10.5281/zenodo.6672165
MusicBO;105;283;Avea pubblicato le Regole del canto fermo ( Napoli , 1609 ) opera debolissima nella quale egli non aveva fatto che affastellare le norme più comuni sparse da più di un secolo in moltissimi libri .;;https://doi.org/10.5281/zenodo.6672165
MusicBO;16;1129;Antonio predicto det dono Bartolomeo tinctoris miniatorj libr.;https://books.google.it/books?id=y0VDAAAAYAAJ&printsec=frontcover&hl=it&source=gbs_ge_summary_r&cad=0#v=onepage&q&f=false;https://doi.org/10.5281/zenodo.6672165
MusicBO;105;5186;L’ Agzese e Le mattre de chapelle nel buffo sono i due principali titoli del Paér alla gloria .;;https://doi.org/10.5281/zenodo.6672165
MusicBO;105;4703;"Inutilmente il grande artista ricevette al Conservatorio un’' ovazione spontanea dai più illustri musicisti , inutilmente egli scrisse pel teatro delle Tuileries quel gioiello d’ operetta che s' intitola Pimmalione ( 1808 ) ;";;https://doi.org/10.5281/zenodo.6672165
MusicBO;105;3359;"12 per piano , due violini , viola e violoncello ;";;https://doi.org/10.5281/zenodo.6672165
MusicBO;105;4686;"Vi si trovano un baccanale di grande effetto e molti pezzi d’ una rara delicatezza d’ espressione ;";;https://doi.org/10.5281/zenodo.6672165
MusicBO;105;5748;Aveva dormito un « poco , e quando si svegliò , fece aprire le cortine del suo « letto per contemplare la luna che , allora nel plenilunio , | « innoltravasi tranquillamente nell’ immensità di un cielo pu« rissimo .;;https://doi.org/10.5281/zenodo.6672165
MusicBO;105;7187;Zingarelli , desiderando avere un saggio tutto suo , lo esortò a far da sè , nè volle minimamente correggere la partitura per poter meglio giudicare dell' avvenire del giovane artista .;;https://doi.org/10.5281/zenodo.6672165
MusicBO;105;1008;Questa serenata epitalamica fu composta per solennizzare il matrimonio di Carlo Spinola e della Paola Brignole , ambo di Genova , celebrato il 6 luglio 1681 .;;https://doi.org/10.5281/zenodo.6672165
MusicBO;105;2807;questa non piacque , mentre la prima fece vivissima impressione ( 16 ottobre 1783 ) ed ebbe lo stesso successo quando nel 1.° dicembre dello stesso anno la si replicò sulle scene dell’ Opéra in Parigi .;;https://doi.org/10.5281/zenodo.6672165
MusicBO;105;5057;"La musica del Fioravanti ottenne molta voga per un brio comico assai vivace ;";;https://doi.org/10.5281/zenodo.6672165
MusicBO;105;2679;GZ erot det Campi Elisi , eseguito nel carnevale del 1779 al San Samuele di Venezia .;;https://doi.org/10.5281/zenodo.6672165
MusicBO;105;335;Mozart però nel 1770 infranse l' ordine senza incorrere nella grave pena minacciata , perchè fu colpito da tanta ammirazione per quella musica che seppe scriverla a memoria in guisa conforme al manoscritto .;;https://doi.org/10.5281/zenodo.6672165
MusicBO;105;6533;La licenza della plebe , aizzata dai demagoghi , lo discacciò nel 1848 dal grato soggiorno di Bologna , chè il suo orrore per le rivoluzioni lo avevano reso sospetto di conservantismo a coloro che dovevano andar superbi di averlo concittadino .;;https://doi.org/10.5281/zenodo.6672165
