corpus_id;document_id;sentence_id;content;document_uri;corpus_uri
MusicBO;105;6871;Verso quell' epoca succedette al Generali nel posto di maestro di cappella della cattedrale di Novara , ma non per questo cessò di lavorare per il teatro :;;https://doi.org/10.5281/zenodo.6672165
MusicBO;105;5768;Tre gran Quartetti a violino , viola , chitarra e violoncello , dedicati alle amatrici , op.;;https://doi.org/10.5281/zenodo.6672165
MusicBO;105;7595;"La clemenz di Tito , Padova , 1771 ;";;https://doi.org/10.5281/zenodo.6672165
MusicBO;105;4840;» La musica sacra del Basily è tenuta in molto pregio ( 1 ) .;;https://doi.org/10.5281/zenodo.6672165
MusicBO;105;1732;Giovanni Antonio Tartini di Firenze e Caterina GioanGrandi di Pirano , gli vollero dare un' educazione finita allo scopo di avviarlo alla vita monastica , ma tale non era il destino del futuro artista .;;https://doi.org/10.5281/zenodo.6672165
MusicBO;105;3365;Moltissime furono ridotte per diversi stromenti , e qualche composizione apocrifa comparve col nome di Boccherini per speculazione di editori disonesti .;;https://doi.org/10.5281/zenodo.6672165
MusicBO;105;6309;La parte principale di quest' opera fu eseguita da Elisabetta Colbran , donna insigne per talento e bellezza , per la quale Rossini scrisse 9 opere , e che finì collo sposare nel 1822 .;;https://doi.org/10.5281/zenodo.6672165
MusicBO;105;2466;Si era ormai giunti al giorno precedente alla consegna del lavoro e Guglielmi non solo nulla avea scritto , ma altro non faceva che cercare scherzi per disturbare i compagni , i quali annoiati lo cacciarono dalla classe .;;https://doi.org/10.5281/zenodo.6672165
MusicBO;105;4948;Giuseppe Farinelli moriva in Trieste il 12 dicembre del 1836 ( 1 ) .;;https://doi.org/10.5281/zenodo.6672165
MusicBO;105;6786;"porzoghest nel Brasile , Rio Janeiro , 1856 ;";;https://doi.org/10.5281/zenodo.6672165
MusicBO;105;3881;"Gli Orazi cd i Curiazit , opera seria in 2 atti , Venezia , teatro della Fenice , carnevale 1797 ( alla Scala di Milano ai 26 dicembre 1797 , ed al San Carlo di Napoli nel 1807 ) ;";;https://doi.org/10.5281/zenodo.6672165
MusicBO;105;2200;È certo che quei critici che parlarono con tanta leggerezza di quest’ opera del Martini non hanno alcuna conoscenza del vecchio contrappunto della scuola italiana , e sono incapaci d’ apprezzarne il merito .;;https://doi.org/10.5281/zenodo.6672165
MusicBO;105;1092;L’ opera terza e la quinta sono i due capolavori di Corelli , ma sopratutte si distingue la quinta per la grandiosità , la ricchezza e la varietà dei canti .;;https://doi.org/10.5281/zenodo.6672165
MusicBO;105;1136;Lo Scarlatti evitò nella Zeodora la monotonia degli accompagnamenti rendendoli variati con disegni speciali .;;https://doi.org/10.5281/zenodo.6672165
MusicBO;105;3016;"L’ incognita , Bologna , 1781 ;";;https://doi.org/10.5281/zenodo.6672165
MusicBO;105;5111;ne apprese con facilità gli elementi da un organista di cui s' ignora il nome , ed ebbe poi a maestro il celebre violinista Ghiretti , antico professore del Conservatorio della Pietà dei Turchini in Napoli , allora al servizio del duca di Parma .;;https://doi.org/10.5281/zenodo.6672165
MusicBO;105;7216;Dopo di lui i maestri ne seguirono l' esempio .;;https://doi.org/10.5281/zenodo.6672165
MusicBO;105;4521;"Tale accusa , che forse avea preso origine dai rapporti del tutto artistici del violinista con Filippo d’ Orléans , era ridicola per chi avesse intimamente conosciuto il Viotti ;";;https://doi.org/10.5281/zenodo.6672165
MusicBO;105;3429;Tuttavia quest’ opera eccellente ebbe accoglienza fredda all' Accademia di musica di Parigi .;;https://doi.org/10.5281/zenodo.6672165
MusicBO;105;1727;100 Giuseppe Tartini Vinci fu maestro della cappella reale .;;https://doi.org/10.5281/zenodo.6672165
MusicBO;105;2404;"Dodici anni prima egli aveva fatto una breve scorsa in Italia mettendo in scena Creso a Roma ed il Zerzisfocle al San Carlo di Napoli ( 18 dicembre 1757 ) ;";;https://doi.org/10.5281/zenodo.6672165
MusicBO;105;3476;però parecchi brani di quest’ opera sono capolavori .;;https://doi.org/10.5281/zenodo.6672165
MusicBO;105;4757;a 75 anni fece un lavoro di 1000 pagine quasi interamente nuovo trasfondendovi il brio giovanile , la freschezza d' idee e l’ accento passionato delle sue prime composizioni .;;https://doi.org/10.5281/zenodo.6672165
MusicBO;14;125;Sul podio era Arturo Toscanini , che diresse l’ Orchestra del Teatro Comunale anche nel Sigfrido del 9 ottobre 1905 ( 9 rappresentazioni ) , con il celebre tenore Giuseppe Borgatti nella parte del protagonista .;http://www.luigiverdi.it/wagner_e_wagnerismo.htm;https://doi.org/10.5281/zenodo.6672165
MusicBO;105;3253;Nel primo saggio del loro talento dato in casa Bagge ottennero grande successo , dovuto in gran parte più che all’ esecuzione , all’ incanto delle composizioni di Boccherini .;;https://doi.org/10.5281/zenodo.6672165
MusicBO;105;6708;// falegname di Livonia , opera comica , Milano , teatro 428;;https://doi.org/10.5281/zenodo.6672165
MusicBO;105;3101;Lo ricevette nel salone di musica , e gli disse con voce commossa :;;https://doi.org/10.5281/zenodo.6672165
MusicBO;105;5944;Raimondi occupò quell’ ufficio sino al 1832 , ( 1 ) 72 ventaglio del Raimondi comparve sulle scene del teatro Alessandro Manzoni di Milano in maggio del 1874 , e vi riportò buonissimo successo .;;https://doi.org/10.5281/zenodo.6672165
MusicBO;105;5925;L’ anno seguente fece rappresentare La forza dell’ immaginazione ossta Il battuto contento , ed il monodramma Ero e Leandro .;;https://doi.org/10.5281/zenodo.6672165
MusicBO;105;5479;"7 solitari , farsa , Venezia , teatro San Moisè , autunno 1810 ;";;https://doi.org/10.5281/zenodo.6672165
MusicBO;105;3941;Questi accettò e si diede tosto al lavoro , che riuscì piuttosto difficile e faticoso per un compositore che aveva poca conoscenza della lingua e niuna della scena francese .;;https://doi.org/10.5281/zenodo.6672165
MusicBO;16;792;Miniatura e contorno assai guasti .;https://books.google.it/books?id=y0VDAAAAYAAJ&printsec=frontcover&hl=it&source=gbs_ge_summary_r&cad=0#v=onepage&q&f=false;https://doi.org/10.5281/zenodo.6672165
MusicBO;112;1094;"la mufica può variare nella melodia ;";https://www.google.it/books/edition/Memorie_storiche_del_p_m_Giambattista_Ma/oayWg6-HWEIC?hl=it&gbpv=0;https://doi.org/10.5281/zenodo.6672165
MusicBO;105;4539;il virtuoso invece aveva acquistato più scienza , e più abilità nella maniera di presentare le sue idee .;;https://doi.org/10.5281/zenodo.6672165
MusicBO;105;6415;"Si fu in quell’ occasione che Rossini conobbe Beethoven ;";;https://doi.org/10.5281/zenodo.6672165
MusicBO;105;6407;Gli avvenimenti non essendo favorevoli al teatro , Rossini rimase inoperoso fino a quando gli pervenne invito di musicare la Matt / de di Shabran per il teatro Apollo di Roma .;;https://doi.org/10.5281/zenodo.6672165
MusicBO;105;6781;"La donna delle Isole , opera seria inedita , scritta nel 1854 ;";;https://doi.org/10.5281/zenodo.6672165
MusicBO;105;200;Fu sepolto in S. Pietro , davanti l’ altare dei SS .;;https://doi.org/10.5281/zenodo.6672165
MusicBO;105;687;etTerqD2® Cesti Marc Antonzo Carissimi , fu nominato maestro di cappella in Firenze da Ferdinando II de’ Medici verso il 1646 , e subito si fece famoso pel suo stile dilettevole , pieno di grazia e di brio .;;https://doi.org/10.5281/zenodo.6672165
MusicBO;105;1792;Pochi strumentisti furono così fecondi come Tartini .;;https://doi.org/10.5281/zenodo.6672165
MusicBO;105;3813;"L’ Arabo cortese ( musica di ° Paisiello con alcune arie ed un duetto di Cimarosa ) , Napoli , teatro Nuovo , farsa , 1776 ;";;https://doi.org/10.5281/zenodo.6672165
MusicBO;105;720;"O taviano Cesare Augusto , Mantova , 1682 ;";;https://doi.org/10.5281/zenodo.6672165
MusicBO;105;5077;"La vera felicità , cantata , Napoli , teatro dei Fiorentini , 1799 ;";;https://doi.org/10.5281/zenodo.6672165
MusicBO;105;6106;Quest’ ultima produzione può esser considerata come il capolavoro del Carafa .;;https://doi.org/10.5281/zenodo.6672165
MusicBO;105;4417;elle ne saurait étre comparée aux excentricités de mécanisme et d’ harmonie de Liszt , ni aux magistrales virtuosités de Thalberg .;;https://doi.org/10.5281/zenodo.6672165
MusicBO;105;5872;Nell’ oratorio Zsacco , che Morlacchi compose a Dresda Francesco Morlacchi 371 nel 1817 , il maestro fece prova di un nuovo canto ritmico per sostituire il recitativo , canto che ottenne grandissimo successo .;;https://doi.org/10.5281/zenodo.6672165
MusicBO;105;3271;« 82 anni conserva sempre tutta la sua freschezza e il suo « splendore .;;https://doi.org/10.5281/zenodo.6672165
MusicBO;105;5252;"al desiderio di acquistarsi larga rinomanza ; abbandonò di soppiatto il Conservatorio , e condottosi a Roma vi .";;https://doi.org/10.5281/zenodo.6672165
MusicBO;105;5398;"L’ autore della Vesta / e passò a Parigi , ove fu nominato membro dell’ Accademia di belle arti ( 1838 ) al posto di Paér ;";;https://doi.org/10.5281/zenodo.6672165
MusicBO;105;7268;non fischiarono forse anche i Romani la Olimpiade del divino Pergolesi ?;;https://doi.org/10.5281/zenodo.6672165
MusicBO;105;4852;Il pregio principale di questa musica consiste nella sua grande semplicità , avendo il compositore evitato ogni complicazione od astruseria atta ad impedire l’ effetto od a renderlo difficile , Nelle condizioni forse in cui doveva essere scritto questo genere di musica , ogni altro stile sarebbe stato im « praticabile , e sotto questo rapporto il A /zserere del Basily può venir considerato un piccolo capolavoro .;;https://doi.org/10.5281/zenodo.6672165
MusicBO;105;5441;Le prime composizioni da chiesa del Coccia levarono tanto grido che l’ impresario del teatro Valle di Roma ne invitò l’ autore a scrivere un’ opera per quelle scene .;;https://doi.org/10.5281/zenodo.6672165
MusicBO;105;5880;Ai 21 di giugno di quell’ anno si inaugurò l’ apertura del teatro Carlo Felice di Genova coll’ opera del Morlacchi Colombo .;;https://doi.org/10.5281/zenodo.6672165
MusicBO;105;1791;Il suo stile è elevato , le idee variate , l' armonia pura senza aridità .;;https://doi.org/10.5281/zenodo.6672165
MusicBO;105;6087;Venne allora a Parigi , e. vi debuttò all’ Opéra Comique colla feazze d’ Arc ( 1821 ) , opera in tre atti che incontrò favore per le graziose melodie , e per la ricchezza e varietà dell' istromentazione .;;https://doi.org/10.5281/zenodo.6672165
MusicBO;105;4751;la Messa da Requiem a quattro voci con orchestra eseguita nell’ anniversario della morte di Luigi XVI , e la Messe du sacre de Charles X scritta dall’ autore in età di 65 anni .;;https://doi.org/10.5281/zenodo.6672165
MusicBO;105;2008;"due libri di Fughe per organo , sei Concerti per violoncello , due violini , viola e basso , scritti nel 1737 e 1738 ;";;https://doi.org/10.5281/zenodo.6672165
MusicBO;105;26;DARWIN , L' origine dell’ uomo e la selezione sessuale .;;https://doi.org/10.5281/zenodo.6672165
MusicBO;105;3024;. La melodia di Sacchini è nobile , spontanea , e toccante nelle scene patetiche , i suoi cori sono potentemente caratteristici , l' armonia purissima e l’ orchestra trattata colla massima chiarezza abbonda di effetti bellissimi e svariati ottenuti coi mezzi più semplici .;;https://doi.org/10.5281/zenodo.6672165
MusicBO;105;4961;"Una cosa strana , amor semplice , farsa , Venezia , teatro San Luca , estate 1800 , Italia al tempio della pace , cantata , Venezia , teatro San Benedetto , primavera 1801 ;";;https://doi.org/10.5281/zenodo.6672165
MusicBO;105;6143;Nel 1860 tradusse in francese la Semiramide di Rossini per il debutto delle sorelle Marchisio , e , a preghiera del suo illustre amico , scrisse la musica pei ballabili introdotti nell’ opera .;;https://doi.org/10.5281/zenodo.6672165
MusicBO;105;6746;"Z / felice imenco , cantata , Napoli , teatro San Carlo , 1839 ;";;https://doi.org/10.5281/zenodo.6672165
MusicBO;105;3210;"La pescatrice fedele , 1776 ;";;https://doi.org/10.5281/zenodo.6672165
MusicBO;105;5565;L' indifferenza del pubblico , ed il deciso insuccesso di qualcuno de’ suoi ultimi lavori , determinarono il Generali ad approfittare dell’ occasione favorevole per ritirarsi dalla palestra drammatica :;;https://doi.org/10.5281/zenodo.6672165
MusicBO;105;670;Dai misteri derivò l’ oraforio , rappresentazione sacra d’ una severità di stile straordinaria , e ne fu l’ inventore San Filippo Neri , che nel 1540 fondò a Roma la Congregazione dei preti dell’ oraforto .;;https://doi.org/10.5281/zenodo.6672165
MusicBO;105;3982;Da allora egli rimase unicamente fedele alle sue funzioni di maestro di cappella della corte .;;https://doi.org/10.5281/zenodo.6672165
MusicBO;105;4817;Lo stravagante ed il dissipatore , scritto pei due celebri buffi Rafanelli e Bassi , e rappresentato alla Yenice di Venezia nella primavera del 1805 , non ebbe Francesco Basily 303 l' esito brillante che lasciavano sperare il talento dei due artisti ed il merito del compositore .;;https://doi.org/10.5281/zenodo.6672165
MusicBO;105;845;Molte di queste composizioni furono riunite da un suo figlio , che le pubblicò nel 1702 col titolo di Ayazmzzenti .;;https://doi.org/10.5281/zenodo.6672165
MusicBO;105;981;Due soprani , contralto , tenore e basso .;;https://doi.org/10.5281/zenodo.6672165
MusicBO;105;3183;La musica semplice e leggiadra di quest’ opera male si prestava all’ esecuzione pesante e monotona dei cantori di quel tempo , e perciò non piacque .;;https://doi.org/10.5281/zenodo.6672165
MusicBO;105;993;lo stromentale è composto di concertino e di concerto grosso .;;https://doi.org/10.5281/zenodo.6672165
MusicBO;105;2637;"Il reverendo Canonico D. Donato Antonio Cavallo vicesostituto ha battezzato ‘ Tomaso , Michele , Francesco , Saverio , figlio leggittimo e nato di Filippo Traetta e di Anna Teresa Piacenti , coniugi ;";;https://doi.org/10.5281/zenodo.6672165
MusicBO;105;4896;Si fu in quel tempo ch' egli scrisse il quartetto dell’ Or /az4do con orchestra , e la scena del Sazle per tenore ed orchestra :;;https://doi.org/10.5281/zenodo.6672165
MusicBO;105;5936;ma questo artista cominciava la sua carriera nello stesso tempo che Rossini , genio possente che s’' impadronì di tutto l' interesse del pubblico , e che gettò nell’ ombra i lavori degli altri maestri d’ Italia .;;https://doi.org/10.5281/zenodo.6672165
MusicBO;105;3143;"Le nozze di Kutk a 4 voci , due violini , viola e basso ;";;https://doi.org/10.5281/zenodo.6672165
MusicBO;105;6154;La morte dell' amico addolorò profondamente il Carafa .;;https://doi.org/10.5281/zenodo.6672165
MusicBO;105;6784;"4 # rzornfo di Giuditta , oratorio , Catania , 1854 ; MVzcol /ò de Lapi , opera seria , Rio Janeiro , 1855 , riprodotta al teatro Pagliano di Firenze nell' autunno del 1873 ;";;https://doi.org/10.5281/zenodo.6672165
MusicBO;105;6799;La natura del suo ingegno grave lo rendeva incline agli studî severi , e nelle sue opere si sente l’ impronta del genio poderoso , ma più riflessivo che audace .;;https://doi.org/10.5281/zenodo.6672165
MusicBO;105;502;musica rappresentata pubblicamente .;;https://doi.org/10.5281/zenodo.6672165
MusicBO;105;5891;Ma inutilmente ! Giunto ad Innspruch fu sorpreso da un mortale assalto di paralisia polmonare , che l' obbligò a fermarvisi .;;https://doi.org/10.5281/zenodo.6672165
MusicBO;105;2771;Ma il nuovo venuto era in condizioni svantaggiose .;;https://doi.org/10.5281/zenodo.6672165
MusicBO;105;2497;152 Pietro Guglielmi cappella di San Pietro in Vaticano , e gli mandò la nomina il 3 marzo del 1793 .;;https://doi.org/10.5281/zenodo.6672165
MusicBO;105;1814;Consistono in dodici Concerti per violino con accompagnamento di due violini , viola e violoncello con basso continuo per il clavicembalo .;;https://doi.org/10.5281/zenodo.6672165
MusicBO;14;105;Nel trigesimo della morte il Municipio di Bologna volle commemorare l’ illustre concittadino con un concerto nell’ aula del Liceo Musicale , diretto da Luigi Mancinelli .;http://www.luigiverdi.it/wagner_e_wagnerismo.htm;https://doi.org/10.5281/zenodo.6672165
MusicBO;112;12;Se stai effettuando delle ricerche nel campo della traduzione automatica , del riconoscimento ottico dei caratteri ( OCR ) o in altri campi dove necessiti di utilizzare grandi quantità di testo , ti invitiamo a contattarci .;https://www.google.it/books/edition/Memorie_storiche_del_p_m_Giambattista_Ma/oayWg6-HWEIC?hl=it&gbpv=0;https://doi.org/10.5281/zenodo.6672165
MusicBO;105;3732;"Cimarosa compose nella capitale dell' Austria l’ opera che si considera come la migliore del repertorio ;";;https://doi.org/10.5281/zenodo.6672165
MusicBO;105;126;ei moriva a Firenze nel 1050 .;;https://doi.org/10.5281/zenodo.6672165
MusicBO;105;3418;Paisiello aveva freddo e si stropicciava le mani intirizzite che non potevano scorrere sulla tastiera .;;https://doi.org/10.5281/zenodo.6672165
MusicBO;105;3215;"Cleopatra , Milano , teatro alla Scala , carnevale 1779 ;";;https://doi.org/10.5281/zenodo.6672165
MusicBO;105;3480;"L' imperatore dapprima lo negò , ma poi acconsentì di mala voglia a lasciar partire l’ artista italiano ;";;https://doi.org/10.5281/zenodo.6672165
MusicBO;105;351;Quivi fece l' invenzione del basso continuo e lo applicò per la prima volta alla sua opera :;;https://doi.org/10.5281/zenodo.6672165
MusicBO;105;2294;Pergolesi ritornò dopo questi lavori al genere drammatico al quale si sentiva portato dal suo istinto di artista , e diede al teatro San Bartolomeo // maestro di musica ed Il geloso schernito , che furono apprezzati degnamente solo dopo la morte dell’ autore .;;https://doi.org/10.5281/zenodo.6672165
MusicBO;105;5095;"L' oraco / o di Cuma , cantata , Napoli , teatro San Carlo , 18 giugno 1815 ;";;https://doi.org/10.5281/zenodo.6672165
MusicBO;105;4178;Sul teatro privato del duca Lante egli fece rappresentare La distruzione di Gerusalemme , spartito che ottenne un esito di tale fanatismo , che per desiderio universale lo si volle riprodotto al teatro Valle , ove rimase in scena per ben cinque anni , chè il pubblico pareva non esserne mai sazio .;;https://doi.org/10.5281/zenodo.6672165
MusicBO;105;3539;Il Barbiere di Rossini disapprovato la prima sera , ebbe alla seconda rappresentazione entusiastici applausi , e fini coll’ ottenere un successo strepitoso .;;https://doi.org/10.5281/zenodo.6672165
MusicBO;112;1036;68 RISPOSTA , Amico Gentiliffimo .;https://www.google.it/books/edition/Memorie_storiche_del_p_m_Giambattista_Ma/oayWg6-HWEIC?hl=it&gbpv=0;https://doi.org/10.5281/zenodo.6672165
MusicBO;105;4147;Lo Zingarelli , vistosi accolto con indifferenza dal pubblico di Parigi , credette bene di lasciare la Francia , e visitando la Svizzera si ricondusse alla sua diletta Milano .;;https://doi.org/10.5281/zenodo.6672165
MusicBO;105;4474;Arrivati a Parigi i due viaggiatori si separarono , ma Viotti conservò sempre per il suo maestro i sentimenti della più affettuosa riconoscenza .;;https://doi.org/10.5281/zenodo.6672165
MusicBO;16;495;Corale membranaceo magnifico e conservatissimo di carte 141 , alte cm. 56 per cent .;https://books.google.it/books?id=y0VDAAAAYAAJ&printsec=frontcover&hl=it&source=gbs_ge_summary_r&cad=0#v=onepage&q&f=false;https://doi.org/10.5281/zenodo.6672165
MusicBO;105;4692;Con una rapidità prodigiosa i francesi entrarono in Vienna , vinsero ad Austerlitz e terminarono la campagna colla pace di Presburgo .;;https://doi.org/10.5281/zenodo.6672165
MusicBO;105;4647;con essa nacque una scuola dotta , coscienzosa , accurata , eminentemente favorevole allo sviluppo dell’ immaginazione musicale .;;https://doi.org/10.5281/zenodo.6672165
MusicBO;105;6079;Seguì Murat nella campagna di Russia col brevetto di primo scudiere , e nel combattimento di Ostrowno meritò col suo valore di essere decorato della croce della Legion d' Onore da Napoleone .;;https://doi.org/10.5281/zenodo.6672165
MusicBO;105;4994;"L' incognita , farsa , Venezia , teatro San Moisè , autunno 1809 ;";;https://doi.org/10.5281/zenodo.6672165
MusicBO;112;1766;Il P. Martini al P. M. Peri ( futti .;https://www.google.it/books/edition/Memorie_storiche_del_p_m_Giambattista_Ma/oayWg6-HWEIC?hl=it&gbpv=0;https://doi.org/10.5281/zenodo.6672165
MusicBO;14;15;Le parti della Messa erano state commissionate a 10 compositori ritenuti tra i più rappresentativi della musica melodrammatica e religiosa italiana .;http://www.luigiverdi.it/wagner_e_wagnerismo.htm;https://doi.org/10.5281/zenodo.6672165
MusicBO;105;6537;"Nel 1855 i sintomi dell' antica malattia si rinnovarono , ed ei dovette di nuovo cercar rimedio a Parigi ;";;https://doi.org/10.5281/zenodo.6672165
MusicBO;105;7147;"L’ Assedio di Calais , Napoli , teatro San Carlo , 19 novembre 1836 ;";;https://doi.org/10.5281/zenodo.6672165
MusicBO;105;3467;Un giorno Bonaparte si lagnava degli artisti della sua cappella , ma Paisiello coraggiosamente gli fece osservare che male si può esscr obbediti da persone che non sono convenientemente pagate , e il primo console provvide subito ad una migliore posizione pei suoi musicisti .;;https://doi.org/10.5281/zenodo.6672165
MusicBO;105;5945;L’ operetta fu trovata piena di vita ed ancora fresca .;;https://doi.org/10.5281/zenodo.6672165
MusicBO;105;3909;Coll' appoggio del potente patrizio , Salieri potè continuare la sua educazione musicale nella cantoria di San Marco , ove ottenne pure tavola ed alloggio coll’ obbligo di cantare nel coro nei giorni festivi .;;https://doi.org/10.5281/zenodo.6672165
MusicBO;105;569;"trattò con maestria la fuga , e fece progredire rapidamente questo genere di composizione così bene adatto all' organo ed alla musica sacra ;";;https://doi.org/10.5281/zenodo.6672165
MusicBO;105;320;"Sette madrigali a 3 voci , Venezia , per Alessandro Vincenti alla Pigna ;";;https://doi.org/10.5281/zenodo.6672165
MusicBO;16;404;Ego siim vox , e nella destra tiene una lunga canna , in atto di confabulare co' due primi discepoli Andrea e il fratello Simone , poscia chiamato Pietro :;https://books.google.it/books?id=y0VDAAAAYAAJ&printsec=frontcover&hl=it&source=gbs_ge_summary_r&cad=0#v=onepage&q&f=false;https://doi.org/10.5281/zenodo.6672165
MusicBO;105;1666;"Porpora era considerato come uno dei primi suonatori di clavicembalo del suo tempo ;";;https://doi.org/10.5281/zenodo.6672165
MusicBO;105;4334;L’ opera 2 di Clementi , che ebbe l’ onore di esser lodata da Emmanuele Bach , richiamò sull’ autore l’ attenzione del mondo musicale .;;https://doi.org/10.5281/zenodo.6672165
MusicBO;105;1144;All’ Odoacre seguirono Pirro e Demetrio 1697 , Il prigioniero fortunato 1698 , Laodicea e Berenice 1701 .;;https://doi.org/10.5281/zenodo.6672165
MusicBO;105;1572;L’ istromentazione si compone di due parti di violino , della viola , del violoncello e dell' organo .;;https://doi.org/10.5281/zenodo.6672165
MusicBO;105;4838;Difatti qualche mese dopo io ricevetti il manoscritto originale di quest' opera , che conservo preziosamente :;;https://doi.org/10.5281/zenodo.6672165
MusicBO;105;688;« La prima sua opera Orortea , fu rappresentata a Venezia nel 1649 e replicata nel 1666 e 1683 .;;https://doi.org/10.5281/zenodo.6672165
MusicBO;105;4143;in sette giorni , l’ autore aveva abbandonato la carriera piuttosto ricercata del I/ ortezuma , e si guadagnava così molto plauso .;;https://doi.org/10.5281/zenodo.6672165
MusicBO;105;4449;suonò la sua parte in orchestra , e seguì poi i musicisti che andavano ad eseguire una sinfonia durante il pranzo del vescovo Francesco Rora .;;https://doi.org/10.5281/zenodo.6672165
MusicBO;105;540;La scelta dei patroni di San Marco fece tacere coloro che capitanati dal bolognese Artusi accusavano il Monteverde di essere scorretto nelle sue composizioni , e che dicevano non comprendere affatto le innovazioni ch' egli introduceva nell’ armonia .;;https://doi.org/10.5281/zenodo.6672165
MusicBO;105;3777;234 Domenico Cimarosa Il cardinale Consalvi , che era stato l' amico ed il protettore del grande artista , gli fece eseguire solenni esequie in Roma nella chiesa di San Carlo dei Catinarî .;;https://doi.org/10.5281/zenodo.6672165
MusicBO;105;6586;"Il dramma eroico Gl° ///inesi , uno dei migliori lavori del Coppola , comparve in carnevale del 1836 sul teatro Regio di Torino ;";;https://doi.org/10.5281/zenodo.6672165
MusicBO;105;2578;"Le vicende d' amore , Roma , 1784 ; / finti amori , Napoli , teatro dei Fiorentini , estate 1784 ;";;https://doi.org/10.5281/zenodo.6672165
MusicBO;105;5197;nel 1831 l’ Istituto di Francia lo elesse a surrogare Catel nella sezione di composizione musicale , e nel 1832 Luigi Filippo gli mandò la nomina di maestro della cappella reale .;;https://doi.org/10.5281/zenodo.6672165
MusicBO;112;206;fu 24. anni in Francia ftipendiato dalla K. Corte , e fu Maeltro , e primo violino di Rems .;https://www.google.it/books/edition/Memorie_storiche_del_p_m_Giambattista_Ma/oayWg6-HWEIC?hl=it&gbpv=0;https://doi.org/10.5281/zenodo.6672165
MusicBO;105;1831;Sei nuove Sonate che formano l’ op .;;https://doi.org/10.5281/zenodo.6672165
MusicBO;105;4067;Numerosi scolari frequentarono la sua scuola , ed egli si acquistò un nome celebre come professore .;;https://doi.org/10.5281/zenodo.6672165
MusicBO;105;4922;"Biittner ha pubblicato a Magonza una traduzione tedesca del libro dell’ Asioli presso l' editore Schott nel 1824 ) ;";;https://doi.org/10.5281/zenodo.6672165
MusicBO;112;976;difegnarono la Chiefa di S. M. Novella in Firenze , che anche nel fecol d’ oro formava le delizie di Michelangelo .;https://www.google.it/books/edition/Memorie_storiche_del_p_m_Giambattista_Ma/oayWg6-HWEIC?hl=it&gbpv=0;https://doi.org/10.5281/zenodo.6672165
MusicBO;105;3357;"OI Quartetti ( per due violini , viola e violoncello ) ;";;https://doi.org/10.5281/zenodo.6672165
MusicBO;105;5897;Morlacchi era membro delle primarie Accademie filarmoniche , artistiche e letterarie d’ Italia e di Germania .;;https://doi.org/10.5281/zenodo.6672165
