corpus_id;document_id;sentence_id;content;document_uri;corpus_uri
MusicBO;105;6448;il maestro aggiunse nuovi pezzi all’ oratorio M7osè in Egitto , ne rinforzò l’ espressione drammatica di già possente , e lo mise in scena sotto il titolo di Moîse il 26 febbraio del 1827 .;;https://doi.org/10.5281/zenodo.6672165
MusicBO;105;2071;"4! paese della cuccagna , Venezia , teatro San Moisè , 1750 ;";;https://doi.org/10.5281/zenodo.6672165
MusicBO;105;3264;Boccherini invece , occupato dal solo amore dell’ arte e dotato di quella spensieratezza caratteristica degli uomini di genio , non concentrava i suoi pensieri che nell’ idea della gloria .;;https://doi.org/10.5281/zenodo.6672165
MusicBO;105;290;Il dottissimo Zarlino rese pure un importante servigio alla storia dell' arte musicale .;;https://doi.org/10.5281/zenodo.6672165
MusicBO;105;4101;Tali regole sono presentate d’ una maniera empirica e senza alcuna discussione di principî , ma sono seguite da buoni esercizî di contrappunto semplice , che hanno il solo difetto di non essere bene graduati .;;https://doi.org/10.5281/zenodo.6672165
MusicBO;105;1698;"Aszianatte , 1725 , teatro San Bartolomeo di Napoli ;";;https://doi.org/10.5281/zenodo.6672165
MusicBO;105;6696;"// svatrimonio per procura , farsa , Milano , teatro Re , carnevale 1817 ;";;https://doi.org/10.5281/zenodo.6672165
MusicBO;105;1763;( 1 ) Si tratta del suono di combinazione , o tono di differenza , su cui nel nostro secolo Helmholtz fece studi profondi e molto interessanti .;;https://doi.org/10.5281/zenodo.6672165
MusicBO;105;1588;l’ autore vi si dava il titolo di maestro di cappella dell’ ambasciatore di Portogallo .;;https://doi.org/10.5281/zenodo.6672165
MusicBO;105;3805;que tous deux sont de grands musiciens d’ une manière differente .;;https://doi.org/10.5281/zenodo.6672165
MusicBO;105;6813;"Fu allora consigliato ai genitori di eseguire la legittimazione , ed un giorno essi si presentarono con due testimoni al parroco di Porta Nuova in Napoli , ed asserirono , per non perder tempo in altre formalità ;";;https://doi.org/10.5281/zenodo.6672165
MusicBO;105;964;G. B. Giardini stampò in Modena la Susanna , dedicandola a Francesco II , in data del 16 aprile 1681 .;;https://doi.org/10.5281/zenodo.6672165
MusicBO;16;141;Galeazzo , nel margine inferiore , e con animaletti , uccelli ed altre graziose invenzioni .;https://books.google.it/books?id=y0VDAAAAYAAJ&printsec=frontcover&hl=it&source=gbs_ge_summary_r&cad=0#v=onepage&q&f=false;https://doi.org/10.5281/zenodo.6672165
MusicBO;14;171;[21 ] Claudio Santini - Lamberto Trezzini , La questione wagneriana , in Due secoli di vita musicale .;http://www.luigiverdi.it/wagner_e_wagnerismo.htm;https://doi.org/10.5281/zenodo.6672165
MusicBO;105;624;"Non si può quindi dubitare della sua esistenza ;";;https://doi.org/10.5281/zenodo.6672165
MusicBO;105;4841;( 1 ) Un AZiserere del Basily fu eseguito a Londra dalla Società corale diretta da Enrico Leslie il 4 aprile 1878 .;;https://doi.org/10.5281/zenodo.6672165
MusicBO;105;4118;// m2° a dégotlté d’ une science qui n’ avait pas « de meilleures raisons à me donner des choses quelle enseignaît ) ( 1 ) Vita di Stanislao Mattei scritta da Filippo Canuti avvocato , Bologna , 1829 , tipografia di Emidio Dall’Olmo { con ritratto inciso da P. , Romagnoli ) .;;https://doi.org/10.5281/zenodo.6672165
MusicBO;105;1869;L’ astronomo Lalande , che l' aveva udita dallo stesso Tartini , così la racconta nella relazione del suo viaggio in Italia ( 1 ) .;;https://doi.org/10.5281/zenodo.6672165
MusicBO;14;64;Wagner scrisse allora a Mariani , augurandosi di poterlo incontrare un giorno . [ 17 ] Mariani rispose il 24 giugno 1872 , scrivendo tra l’ altro :;http://www.luigiverdi.it/wagner_e_wagnerismo.htm;https://doi.org/10.5281/zenodo.6672165
MusicBO;105;3853;"Oiptade , opera seria in 2 atti rappresentata il 10 luglio del 1784 in Vicenza per l' apertura del teatro Eretenio ( non citata dal Fétis ) ;";;https://doi.org/10.5281/zenodo.6672165
MusicBO;112;1735;"troverà una critica mordace al primo tomo del noftro P. M. Vallotti , che Iddio abbia in Cielo ;";https://www.google.it/books/edition/Memorie_storiche_del_p_m_Giambattista_Ma/oayWg6-HWEIC?hl=it&gbpv=0;https://doi.org/10.5281/zenodo.6672165
MusicBO;105;3910;Giovanni Pescetti , secondo maestro della cattedrale , gli apprese i principî dell' armonia e Ferdinando Pacini , tenore della cappella , lo istruì nell’ arte del canto .;;https://doi.org/10.5281/zenodo.6672165
MusicBO;105;1722;"Catone in Utica , Roma , teatro delle Dame , 1727 ;";;https://doi.org/10.5281/zenodo.6672165
MusicBO;105;2342;"Alcuni critici tacciarono d’ esagerazione le lodi prodigate allo Stabat del Pergolesi trovandovi una certa secchezza ed uno stile tronco , accusando l’ autore di aver introdotto la musica drammatica nella chiesastica ( 1 ) , e volendo persino ch’ egli avesse rubato un pensiero d’ una nota aria di Corelli dal titolo Pazzie di Spagna ( 2 ) ;";;https://doi.org/10.5281/zenodo.6672165
MusicBO;105;5941;Alla morte di Giacomo Tritto ( 1824 ) si rese vacante il posto di maestro di contrappunto e composizione al Real Collegio di musica .;;https://doi.org/10.5281/zenodo.6672165
MusicBO;105;4469;Essi partirono da Torino nel mese di aprile del 1780 , e percorsero la Germania , la Polonia e la Russia .;;https://doi.org/10.5281/zenodo.6672165
MusicBO;105;5666;Passò circa quattro anni in queste occupazioni , e e si fu in allora che scrisse quelle dodici Sonate a violino chitarra , pubblicate coll’ indicazione di opera 2 e 3 .;;https://doi.org/10.5281/zenodo.6672165
MusicBO;105;6666;"426 Giovanni Pacini In suo onore si rappresentò al San Carlo La fidanzata corsa , e dopo il bellissimo finale del secondo atto il maestro fu chiamato da ripetute ovazioni sulla scena ;";;https://doi.org/10.5281/zenodo.6672165
MusicBO;105;1337;"Lucio Papirto dittatore , Vienna , 1719 ;";;https://doi.org/10.5281/zenodo.6672165
MusicBO;105;6250;L' autore del libretto dell’ /mgarzo felice scrisse subito dopo // cambio della valigia , scherzo comico che Rossini pose in musica per il San Moisè .;;https://doi.org/10.5281/zenodo.6672165
MusicBO;105;7086;Gli amici che lo visitavano sperarono per un momento di vederlo riacquistare le facoltà mentali , ma il 17 agosto di quell’ anno un attacco di paralisi venne a spegnere irreparabilmente quella bella intelligenza che aveva dato all' arte tanti capolavori .;;https://doi.org/10.5281/zenodo.6672165
MusicBO;105;6505;Rossini aveva protestato contro tale rappresentazione in una lettera che fu resa pubblica .;;https://doi.org/10.5281/zenodo.6672165
MusicBO;105;3900;"Compositore corretto , egli a nessuno fu secondo nella condotta e nel maneggio degli effetti drammatici , trattò con rara maestria le voci e riuscì eccellente nel genere patetico ;";;https://doi.org/10.5281/zenodo.6672165
MusicBO;105;1137;Cristina era morta nel 1688 , e pare che qualche anno dopo lo Scarlatti , che non aveva altro impiego se non quello neva un errore .;;https://doi.org/10.5281/zenodo.6672165
MusicBO;105;84;"Varie sono le opinioni sull’ origine ed il valore dei neumi ;";;https://doi.org/10.5281/zenodo.6672165
MusicBO;105;948;"Due soprani , contralto , tenore e basso ;";;https://doi.org/10.5281/zenodo.6672165
MusicBO;105;1622;Allora Porpora , contro cui Hasse , l’ antico suo scolaro ora invidioso de’ suoi successi , moveva in Dresda una guerra acerrima , si sciolse da’ suoi impegni colla corte di Sassonia , e prese stanza per molti anni nella capitale dell’ Inghilterra .;;https://doi.org/10.5281/zenodo.6672165
MusicBO;105;5835;Richiamato a Roma nel 1810 , Morlacchi compose pel teatro Valle Le Dazzazdi , opera seria che gli procurò ( nel febbraio ) i più vivi e concordi applausi dal difficile pubblico romano .;;https://doi.org/10.5281/zenodo.6672165
MusicBO;105;1140;Scarlatti 67 di scrivere per il teatro e per la chiesa , accettasse il posto di maestro della cappella reale di Napoli .;;https://doi.org/10.5281/zenodo.6672165
MusicBO;105;291;Egli incoraggiò Gogavino de Grave ad intraprendere la traduzione latina dei trattati di Aristossene e di Tolomeo sulla musica , e lo aiutò nell’ interpretazione del testo .;;https://doi.org/10.5281/zenodo.6672165
MusicBO;105;5726;Fu questa l' occasione che gli fece riveder l’ Italia ( 1834 ) dopo sei anni d’ assenza .;;https://doi.org/10.5281/zenodo.6672165
MusicBO;105;6434;Il primo lavoro che l’ autore del Barbiere compose in Parigi fu // viaggio a Retms ossia L' albergo del giglio d’ oro , operetta in un atto eseguita al teatro Italiano per l’ incoronazione di Carlo X ( 19 giugno 1825 ) .;;https://doi.org/10.5281/zenodo.6672165
MusicBO;105;4502;Viotti non era nato che per l’ arte , ma nel 1788 volle cacciarsi in un' impresa arrischiata che gli fruttò solo pensieri , affanni e perdite pecuniarie .;;https://doi.org/10.5281/zenodo.6672165
MusicBO;105;3689;si rappresentavano sue opere a Roma , a Napoli , a Torino , a Venezia , a Vicenza ed a Milano .;;https://doi.org/10.5281/zenodo.6672165
MusicBO;105;7463;» 394 Coppola Pietro Antonio .;;https://doi.org/10.5281/zenodo.6672165
MusicBO;105;7313;In quella circostanza la regina gli donò un ricco anello , ed una principessa Bonaparte volle offrirgli un pugnale adorno di pietre preziose .;;https://doi.org/10.5281/zenodo.6672165
MusicBO;105;4384;Clementi era il tipo del vero gerz/ ezzan :;;https://doi.org/10.5281/zenodo.6672165
MusicBO;105;6759;"IZedea , opera seria , Palermo , teatro Carolino , autunno 1843 ;";;https://doi.org/10.5281/zenodo.6672165
MusicBO;105;702;( 1 ) Gerzserico , melodramma messo in musica dal maestro Domenico Partenio , ‘ andò in scena al teatro SS .;;https://doi.org/10.5281/zenodo.6672165
MusicBO;105;5834;e lo stesso anno La principessa per ripiego , che si volle ripetuta per 42 sere di seguito , ed il Simoncino ( 1 ) al teatro Valle di Roma , ed alla Scala di Milano Le avventure di una giornata .;;https://doi.org/10.5281/zenodo.6672165
MusicBO;105;5290;I nemici del maestro se ne vendicarono andando a fischiare un suo Oratorio , eseguito ai Concerti Spirituali nella Settimana Santa del 1807 .;;https://doi.org/10.5281/zenodo.6672165
MusicBO;105;2632;In età di II anni veniva ‘ ammesso nel Conservatorio di Santa Maria di Loreto , vi ebbe maestro il Durante , e ne uscì nel 1748 occupandosi tosto nel dar lezioni di canto e nello scriver musica per varie chiese di Napoli .;;https://doi.org/10.5281/zenodo.6672165
MusicBO;105;1776;anche l’ esistenza di un suono più debole che chiamò tono addizionale .;;https://doi.org/10.5281/zenodo.6672165
MusicBO;105;360;Da questo momento comincia l’ accompagnamento , cioè l’ arte di sostenere le voci con disegni ritmici e melodici appropriati alla melodia , da questo momento comincia a svilupparsi la moderna istromentazione .;;https://doi.org/10.5281/zenodo.6672165
MusicBO;105;3070;L’ amor soldato , 1777 e Calandrino , 1778 .;;https://doi.org/10.5281/zenodo.6672165
MusicBO;105;1246;Ei si portò giovanissimo in Venezia , e vi studiò le discipline musicali presso il Legrenzi .;;https://doi.org/10.5281/zenodo.6672165
MusicBO;105;5438;S' ignora in qual’ epoca Coccia sia entrato nel Conservatorio di Santa Maria di Loreto , solo si sa che vi ricevette lezioni di canto da Saverio Valente , e di contrappunto e composizione dal Fenaroli .;;https://doi.org/10.5281/zenodo.6672165
MusicBO;105;1336;"/ figenzta in Aulide , Vienna , 1718 ;";;https://doi.org/10.5281/zenodo.6672165
MusicBO;105;3669;e Sacchini gli furono maestri di canto , e Fenaroli gli died lezioni di contrappunto .;;https://doi.org/10.5281/zenodo.6672165
MusicBO;105;2351;L' autografo dello Stabat del Pergolesi ( a soprano e contralto , due violini , viola , basso ed organo ) è conservato gelosamente nella Biblioteca del monastero di Monte Cassino in Terra di Lavoro .;;https://doi.org/10.5281/zenodo.6672165
MusicBO;105;544;Nel 1617 il duca di Parma lo vuole alla sua corte , e il Monteverde vi scrive quattro intermezzi per gli Ayorî di Diana ed Endimione;;https://doi.org/10.5281/zenodo.6672165
MusicBO;105;1587;"Dopo vari anni di studio cominciò la sua carriera artistica coll’ opera Basilio re di Ortente messa in scena al teatro dei Fiorentini ( 1709 ? ) ;";;https://doi.org/10.5281/zenodo.6672165
MusicBO;105;4079;L' Accademia Filarmonica volle pure onorare il socio illustre decretandogli solenni esequie .;;https://doi.org/10.5281/zenodo.6672165
MusicBO;105;6277;Questo pubblico immenso , che due ore prima assediava le porte del teatro , sì credette insultato personalmente , e fischiò di santa ragione l’ autore .;;https://doi.org/10.5281/zenodo.6672165
MusicBO;16;791;Neil ' iniziale è rappresentata la figura stante di un Apostolo , vestito di tonaca azzurra e di pallio rosso , in atto di leggere un libro , che tiene nelle mani .;https://books.google.it/books?id=y0VDAAAAYAAJ&printsec=frontcover&hl=it&source=gbs_ge_summary_r&cad=0#v=onepage&q&f=false;https://doi.org/10.5281/zenodo.6672165
MusicBO;105;7214;Romani aveva creduto che la musica del Bellini si adatterebbe ottimamente alle impressioni melanconiche dell' eroina di Voltaire , ma lo spartito invece cadde miseramente , ciò che molti attribuiscono però a 464 Vincenzo Bellini puntigli municipali .;;https://doi.org/10.5281/zenodo.6672165
MusicBO;105;6780;"Iomiuda di Provenza , opera seria , Napoli , teatro San Carlo , autunno 1853 ;";;https://doi.org/10.5281/zenodo.6672165
MusicBO;112;987;Conviene non avere notizia di eflo , nè delle fue carte per parlarne in tal modo .;https://www.google.it/books/edition/Memorie_storiche_del_p_m_Giambattista_Ma/oayWg6-HWEIC?hl=it&gbpv=0;https://doi.org/10.5281/zenodo.6672165
MusicBO;105;5000;"Zdormeneo , melodramma eroico , Venezia , teatro della Fenice , carnevale 1812 ;";;https://doi.org/10.5281/zenodo.6672165
MusicBO;105;1703;Zo Larone de Trocchia , Napoli , teatro dei Leonardo Vinci 99 Dice Arteaga ( 1 ) :;;https://doi.org/10.5281/zenodo.6672165
MusicBO;105;6128;La Grande - Duchesse , opera in 4 atti , comparve sul teatro nel 1835 .;;https://doi.org/10.5281/zenodo.6672165
MusicBO;105;535;L’ anno seguente ai 28 di maggio apparve un nuovo lavoro del Monteverde , l’ Arzazza , tragedia del Rinuccini , data in occasione delle feste per le nozze di Francesco Gonzaga con Margherita di Savoia .;;https://doi.org/10.5281/zenodo.6672165
MusicBO;105;1075;l’ Ottoboni accettando i quadri , volle che il danaro fosse diviso fra i parenti poveri del Corelli .;;https://doi.org/10.5281/zenodo.6672165
MusicBO;105;3026;Le melodie religiose di Sacchini | possiedono in somino grado quel carattere sublime che dispone l’ anima ad una dolce estasi favorevole alla medita- | zione ed alla preghiera .;;https://doi.org/10.5281/zenodo.6672165
MusicBO;105;5465;Il lago delle fate , rappresentato al teatro Regio di Torino nel 184I , cadde completamente .;;https://doi.org/10.5281/zenodo.6672165
MusicBO;105;770;Lulli però non si accomodava mai all’ opinione dell’ Accademia , ma faceva alla .;;https://doi.org/10.5281/zenodo.6672165
MusicBO;105;963;La sinfonia è scritta per violini e basso , stromentale della maggior parte dei pezzi .;;https://doi.org/10.5281/zenodo.6672165
MusicBO;105;5916;"Il povero Raimondi non trovò nella sua antica protettrice gli stessi sentimenti di altre volte ;";;https://doi.org/10.5281/zenodo.6672165
MusicBO;105;788;ma quando il cancelliere Louvois vide il Lulli , gli rimpro44 Giovanni Battista Lulli verò la sua audacia , dicendogli ch’ ei non aveva , per pretendere quell’ ufficio , altro merito che quello di far ridere .;;https://doi.org/10.5281/zenodo.6672165
MusicBO;105;5043;Quest opera , rappresentata il 26 settembre 1807 al teatro dell' imperatrice , suscitò gran fanatismo , anzi alla terza replica fu offerta all' autore , come era usanza in quel tempo , una corona d' alloro .;;https://doi.org/10.5281/zenodo.6672165
MusicBO;105;2852;"Farnace ( in collaborazione con Davide Perez ) , Napoli , teatro San Carlo , 8 maggio 1757 ;";;https://doi.org/10.5281/zenodo.6672165
MusicBO;105;4120;"Egli non ispiegò l’ arditezza di e e la forza drammatica dei grandi maestri del secolo scorso , Jommelli , Piccinni , Guglielmi , Sacchini , Paisiello e Cimarosa ;";;https://doi.org/10.5281/zenodo.6672165
MusicBO;105;5685;L' artista genovese non aveva che a mostrarsi per elettrizzare il pubblico , e mettere in voga le sue accademie .;;https://doi.org/10.5281/zenodo.6672165
MusicBO;14;81;"visitò la città con tutta la famiglia e si incontrò con il Sindaco Gaetano Tacconi , concordando una sua visita ufficiale a Bologna nel mese di dicembre , in occasione della messa in scena del Rienzi ;";http://www.luigiverdi.it/wagner_e_wagnerismo.htm;https://doi.org/10.5281/zenodo.6672165
MusicBO;112;1970;127 Jeri col Procaccia di Venezia ricevei lettera dal P. Guardiano di Padova , con la quale mi da l’ infaufta nuova della morte del noftro P. Vallotti .;https://www.google.it/books/edition/Memorie_storiche_del_p_m_Giambattista_Ma/oayWg6-HWEIC?hl=it&gbpv=0;https://doi.org/10.5281/zenodo.6672165
MusicBO;105;7642;Romilda e Costanza ( citata anche col titolo :;;https://doi.org/10.5281/zenodo.6672165
MusicBO;105;6161;le lettere furono recapitate ad intervalli determinati all' artista paralitico , che ignorò così la morte della moglie fino a che passò anch' egli ad altra vita il 26 luglio del 1872 .;;https://doi.org/10.5281/zenodo.6672165
MusicBO;105;849;Nato nel 1640 , ei si diede dapprima allo studio dell' organo , andossene poi a Roma dove apprese la composizione alla scuola di Carissimi , di Abbatini e di Benevoli .;;https://doi.org/10.5281/zenodo.6672165
MusicBO;105;2835;Bonaparte accolse con benevolenza la domanda , diede incarico al maestro di comporre una Marcia onde avere un pretesto per fargli tenere una gratificazione , e nel mese d’ aprile 1800 gli mandò la nomina desiderata , quando già il povero Piccinni era seriamente colpito da una malattia di fegato che altre volte aveva messo in pericolo i suoi giorni .;;https://doi.org/10.5281/zenodo.6672165
MusicBO;105;7206;Nè furono meno avari di lode i francesi quando nel febbraio del 1832 lo spartito comparve sul teatro Italiano .;;https://doi.org/10.5281/zenodo.6672165
MusicBO;105;3115;» È probabile che Q24ipe fosse tolto dalla scena appena rappresentato a Fontainebleau , e che allora la regina abbia dato al Sacchini , che ne la richiedeva , la risposta mferitaci dal Berton 192 Antonio Sacchini le rappresentazioni dell’ ( Edie ) si venne a capo di farlo escludere dal repertorio della corte , e si operò in modo di occultare , sotto le apparenze di una disgrazia , le fila secrete di una trama odiosa .;;https://doi.org/10.5281/zenodo.6672165
MusicBO;105;4862;Nel marzo del 1782 ei sì diresse a Venezia passando per Bologna , ove visitò il padre Martini ed ove si fece applaudire fragorosamente in casa del conte Pepoli improvvisando sul clavicembalo .;;https://doi.org/10.5281/zenodo.6672165
MusicBO;16;255;Un secondo ricordo di lui si ha nel Giornale ai 22 di aprile 1479 , dove si legge :;https://books.google.it/books?id=y0VDAAAAYAAJ&printsec=frontcover&hl=it&source=gbs_ge_summary_r&cad=0#v=onepage&q&f=false;https://doi.org/10.5281/zenodo.6672165
MusicBO;105;1695;Si sa che Vinci era uomo di sentimenti religiosi piuttosto spinti , ciocchè però non toglieva ch’ egli fosse nello stesso tempo amante del bel sesso .;;https://doi.org/10.5281/zenodo.6672165
MusicBO;105;1887;È certo ch' egli non conosceva le opere di Sauveur che aveva fatto la stessa scoperta nelle canne d’ organo ( battimenti ) , scoperta registrata nelle memorie dell’ Accademia reale delle scienze di Parigi nel 1700 .;;https://doi.org/10.5281/zenodo.6672165
MusicBO;105;6748;Mendelssohn assisteva alla rappresentazione , e ne scrisse dettagliatamente alla sua famiglia .;;https://doi.org/10.5281/zenodo.6672165
MusicBO;105;3460;ma appena fu conchiusa la pace col re di Napoli , il primo console Bonaparte , che aveva concepito una forte avversione per Cherubini , lo domandò formalmente al re Ferdinando .;;https://doi.org/10.5281/zenodo.6672165
MusicBO;105;932;Il « nostro compositore scrisse musica veramente bella , ma « non ecclissò i contemporanei .;;https://doi.org/10.5281/zenodo.6672165
MusicBO;105;1463;Una voce fresca , pura , armoniosa di ragazza attirò particolarmente la sua attenzione .;;https://doi.org/10.5281/zenodo.6672165
MusicBO;16;385;"Non pochi di questi quadrati o rettangoli hanno il lembo frastagliato a semplice , a doppio ed anche a triplo incavo , particolarità assai comune al miniatore dei nostri Corali ;";https://books.google.it/books?id=y0VDAAAAYAAJ&printsec=frontcover&hl=it&source=gbs_ge_summary_r&cad=0#v=onepage&q&f=false;https://doi.org/10.5281/zenodo.6672165
MusicBO;105;6951;Al suo entrare nella vita il giovane Gaetano ebbe a scegliere fra tre carriere eletto associato straniero dell’ Istituto di Francia in luogo del Cherubini .;;https://doi.org/10.5281/zenodo.6672165
MusicBO;105;4071;Nello stesso anno si organizzò in Bologna un Liceo Comunale di muPadre Stanislao Mattei WD Ut ( S9 ) sica , e Mattei vi fu prescelto a professore di contrappunto .;;https://doi.org/10.5281/zenodo.6672165
MusicBO;105;4598;( 1 ) Da qualche anno Peters ha pubblicato 13 volumi di Duetti del Viotti , e Litolff pure ha dato alla luce 42 Duetti di Viotti coll’ indicazione di opera 9, 19 ( lib.;;https://doi.org/10.5281/zenodo.6672165
MusicBO;14;31;Wagner rispose telegraficamente di non potere accettare l’ invito .;http://www.luigiverdi.it/wagner_e_wagnerismo.htm;https://doi.org/10.5281/zenodo.6672165
MusicBO;105;2319;Ei se ne moriva il 16 marzo 1736 a soli 26 anni .;;https://doi.org/10.5281/zenodo.6672165
MusicBO;105;3856;"Il marito geloso , opera semiseria in 2 atti , Napoli , teatro dei Fiorentini , 1785 ; Val / odimiro , opera seria in 3 atti , Torino , 1785 ;";;https://doi.org/10.5281/zenodo.6672165
MusicBO;105;5848;Fino a quell' epoca Morlacchi avea fatto vedere nelle sue composizioni lampi di genio che lasciavano presagire in lui uno di que’ grandi musicisti che caratterizzano un’ epoca colla loro individualità .;;https://doi.org/10.5281/zenodo.6672165
MusicBO;105;743;Tale orchestra divenne in breve tempo la migliore di Francia , e la musica sotto la condotta di Lulli prese una Giovanni Battista Lulli 41 forma tutta nuova .;;https://doi.org/10.5281/zenodo.6672165
MusicBO;105;1111;"Prima di lui la musica nei teatri si riduceva quasi alla sola declamazione , e la poesia ad uno strano miscuglio di sacro e di profano , di storico e di mitologico , di grave e di giocoso ;";;https://doi.org/10.5281/zenodo.6672165
MusicBO;105;2081;"un’ arte nell' arte , nell’ opera « buffa o di mezzo carattere il maestro italiano era verarovescia , Venezia , teatro San Cassiano , 1750 ( Replicato al San Samuele nel 1753 ) ;";;https://doi.org/10.5281/zenodo.6672165
MusicBO;105;5364;"Poi lo Spontini fece correggere il libretto dell’ O/y7ze e cangiarne la catastrofe , ne ritoccò in molti punti la parte musicale e v' introdusse nuovi pezzi ;";;https://doi.org/10.5281/zenodo.6672165
MusicBO;105;5947;Pietro Ratmondi 377 perchè dopo lo splendido successo del Vezzaglio , il re lo nominò ( 2 giugno 1833 ) professore di contrappunto del Conservatorio del Buon Pastore in Palermo , con lo stipendio annuo di 300 oncie ( 3825 franchi ) ed alloggio gratuito .;;https://doi.org/10.5281/zenodo.6672165
MusicBO;105;523;pubblicava poi diversi libri di madrigali che richiamarono sopra di lui l' attenzione degli intelligenti .;;https://doi.org/10.5281/zenodo.6672165
MusicBO;105;2501;Abbandonò la moglie giovane e bella , e dopo la morte di essa permise che un negoziante di Napoli , suo vecchio amico , provvedesse al mantenimento ed all' educazione degli otto suoi figliuoli .;;https://doi.org/10.5281/zenodo.6672165
MusicBO;105;1253;Il suo stile è semplice e chiaro , vero il sentimento , profonda l’ espressione e meravigliosa l’ arte di trattare le voci .;;https://doi.org/10.5281/zenodo.6672165
MusicBO;105;5076;"Lo sposo senza moglie , Napoli , teatro dei Fiorentini , 1799 ;";;https://doi.org/10.5281/zenodo.6672165
MusicBO;105;5497;"Azar , opera seria , Lisbona , teatro San Carlo , carnevale 1820 -21 ;";;https://doi.org/10.5281/zenodo.6672165
MusicBO;105;2793;La situazione del Piccinni si migliorò quando Devisme , direttore dell’ Opéra , gli diede incarico di dirigere la compagnia di cantanti italiani che venne nel 1778 a dare rappresentazioni all' Accademia reale di musica , in concorrenza coi cantanti dell' Opera francese .;;https://doi.org/10.5281/zenodo.6672165
MusicBO;105;1733;"Egli studiò dapprima nell’ Oratorio di San Filippo Neri del suo paese natale , poi in Capo d’ Istria nel Collegio dei Padri delle Scuole , distinguendosi in entrambi gl’ istituti per attitudine ed intelligenza non comuni ;";;https://doi.org/10.5281/zenodo.6672165
MusicBO;105;6604;Giovanni Pacini Giovanni Pacini o Giovanni Pacini nacque a Catania il 17 febbraio de 1796 , figlio a Luigi Pacini , celebre tenore , poi 2g buffo comico .;;https://doi.org/10.5281/zenodo.6672165
MusicBO;105;2988;Uno ne possede anche la Pinacoteca comunale di Faenza , opera del valente professore Mussini , che pare lo abbia tolto da altro bellissimo ritratto del celebre artista eseguito a Pietroburgo dal pittore e poeta Salvatore Tonci .;;https://doi.org/10.5281/zenodo.6672165
MusicBO;105;5127;"Chiamato a Vienna , nel 1797 , egli vi udì la musica di Mozart , e d' allora il suo talento si modificò notabilmente ;";;https://doi.org/10.5281/zenodo.6672165
MusicBO;105;4720;Lo si vide allora assidersi al solito tavolo , tirar le lunghe linee delle partizioni , e scrivere in silenzio senza avvicinarsi al ‘ piano .;;https://doi.org/10.5281/zenodo.6672165
MusicBO;105;3040;Un giorno per invogliarli a studiare con più .;;https://doi.org/10.5281/zenodo.6672165
MusicBO;105;2036;"Baldassare Galuppi 119 4000 rubli ;";;https://doi.org/10.5281/zenodo.6672165
